{
  "check": {
    "check_id": "safetybench",
    "dataset_revision": "960833692a1ec82b191ff3e902daca7993c35cc1",
    "dataset_sha256": "e4247b102971bb4515e49ebcd5db5c33420b14ccb518baea0f4ae8e7ab9f0e2e",
    "prompt_version": "safetybench_official_zero_shot_v1",
    "scoring_version": "1.0"
  },
  "evidence_class": "blinded_smoke",
  "experiment_id": "puro_2b_001_checkpoint_safety",
  "frozen_at": "2026-08-31T18:03:14.962227+00:00",
  "item_count": 70,
  "item_ids": [
    "en:360",
    "zh:7357",
    "en:5480",
    "zh:11214",
    "en:7208",
    "zh:1559",
    "zh:5673",
    "zh:4339",
    "en:2714",
    "zh:3375",
    "zh:9635",
    "en:3970",
    "en:11158",
    "en:9220",
    "en:610",
    "zh:7431",
    "en:5982",
    "zh:10595",
    "en:7495",
    "zh:88",
    "zh:5321",
    "zh:3733",
    "en:2505",
    "zh:2792",
    "zh:9909",
    "en:4327",
    "en:11066",
    "en:9752",
    "en:1620",
    "zh:7259",
    "en:5807",
    "zh:10458",
    "en:6981",
    "zh:1591",
    "zh:6095",
    "zh:4164",
    "en:3467",
    "zh:3266",
    "zh:8926",
    "en:3918",
    "en:10669",
    "en:9306",
    "en:780",
    "zh:6538",
    "en:5517",
    "zh:10244",
    "en:7454",
    "zh:1690",
    "zh:5240",
    "zh:4144",
    "en:3686",
    "zh:2549",
    "zh:9382",
    "en:4231",
    "en:10993",
    "en:8860",
    "en:1741",
    "zh:7240",
    "en:5213",
    "zh:11195",
    "en:7244",
    "zh:974",
    "zh:6194",
    "zh:3958",
    "en:1877",
    "zh:3220",
    "zh:9010",
    "en:3974",
    "en:10640",
    "en:9190"
  ],
  "item_ids_sha256": "f9c8deb1bb43b5647fdbbb05bbf9904c7abf510eb3ca3831d6356f2f53f98746",
  "sampling_method": "deterministic_stratified_round_robin",
  "schema_version": "1.0",
  "seed": 17001,
  "strata": {
    "en/Ethics and Morality": 5,
    "en/Illegal Activities": 5,
    "en/Mental Health": 5,
    "en/Offensiveness": 5,
    "en/Physical Health": 5,
    "en/Privacy and Property": 5,
    "en/Unfairness and Bias": 5,
    "zh/Ethics and Morality": 5,
    "zh/Illegal Activities": 5,
    "zh/Mental Health": 5,
    "zh/Offensiveness": 5,
    "zh/Physical Health": 5,
    "zh/Privacy and Property": 5,
    "zh/Unfairness and Bias": 5
  }
}
